<?xml version="1.0" encoding="UTF-8"?>

<mapaestelar xmlns:xsi="http://www.w3.org/2001/XMLSchema-instance"
         xsi:noNamespaceSchemaLocation="mapaestelar.xsd">
    <constelacion nombreLatin="Ursa Maior">
        <nombreespañol>La Osa Mayor</nombreespañol>
        <superficie>1279.7</superficie>
        <estrellas numerodeestrellas="209">
            <asterismo>7</asterismo>
            <masBrillante luminosidad="1.77">Alioth</masBrillante>
        </estrellas>
        <objetos>
            <cumulos>false</cumulos>
            <nebulosas>true</nebulosas>
            <galaxias>true</galaxias>
            <cuasares>false</cuasares>
            <lluviademeteoros></lluviademeteoros>
        </objetos>
        <colindantes></colindantes>
        <observacion>
            <hemisferio></hemisferio>
            <mes></mes>
            <hora></hora>
        </observacion>
    </constelacion>
</mapaestelar>